{
  "id": "JORNADA-CIERRE-DURABLE-26",
  "jornadaId": "JORNADA-CIERRE-DURABLE-26",
  "estado": "PENDIENTE",
  "fase": "LINEAS",
  "cursor": 0,
  "cantidadLineas": 271,
  "cantidadOcupaciones": 271,
  "cantidadAutorizaciones": 3,
  "lineasProcesadas": 0,
  "ocupacionesProcesadas": 0,
  "autorizacionesProcesadas": 0,
  "intentos": 0,
  "huellaAlcance": "aaaaaaaaaaaaaaaaaaaaaaaaaaaaaaaaaaaaaaaaaaaaaaaaaaaaaaaaaaaaaaaa",
  "versionInicio": 7,
  "versionFinal": 8,
  "actorUsuarioId": "uid-supervisor",
  "claveIdempotencia": "cerrar-jornada-ficticia-26",
  "idempotenciaId": "bbbbbbbbbbbbbbbbbbbbbbbbbbbbbbbbbbbbbbbbbbbbbbbbbbbbbbbbbbbbbbbb",
  "payloadHash": "cccccccccccccccccccccccccccccccccccccccccccccccccccccccccccccccc",
  "lineaDocumentoIds": ["JORNADA-CIERRE-DURABLE-26__LINEA-1", "JORNADA-CIERRE-DURABLE-26__LINEA-2"],
  "lineaIds": ["LINEA-1", "LINEA-2"],
  "autorizacionIds": ["uid-supervisor", "uid-auxiliar"],
  "creadoEn": "2026-07-31T21:00:00.000Z",
  "actualizadoEn": "2026-07-31T21:00:00.000Z"
}
